[
  {
    "id": "hsk:0001",
    "hanzi": "我",
    "pinyin": "wǒ",
    "en_meaning": "I; me",
    "ru_meaning": "я",
    "hsk_level": 1,
    "example_zh": "我是学生。",
    "example_pinyin": "Wǒ shì xuésheng.",
    "example_en": "I am a student.",
    "mnemonic_ru": "我 — представь копьё в руке: «я» защищаю то, что моё."
  },
  {
    "id": "hsk:0002",
    "hanzi": "你",
    "pinyin": "nǐ",
    "en_meaning": "you",
    "ru_meaning": "ты",
    "hsk_level": 1,
    "example_zh": "你好。",
    "example_pinyin": "Nǐ hǎo.",
    "example_en": "Hello.",
    "mnemonic_ru": "你 — человек 亻 обращается к «ты»: рядом стоящий собеседник."
  },
  {
    "id": "hsk:0003",
    "hanzi": "他",
    "pinyin": "tā",
    "en_meaning": "he; him",
    "ru_meaning": "он",
    "hsk_level": 1,
    "example_zh": "他是老师。",
    "example_pinyin": "Tā shì lǎoshī.",
    "example_en": "He is a teacher.",
    "mnemonic_ru": "他 — человек 亻 + 也 (тоже): «он тоже» пришёл, третье лицо."
  },
  {
    "id": "hsk:0004",
    "hanzi": "她",
    "pinyin": "tā",
    "en_meaning": "she; her",
    "ru_meaning": "она",
    "hsk_level": 1,
    "example_zh": "她是医生。",
    "example_pinyin": "Tā shì yīshēng.",
    "example_en": "She is a doctor.",
    "mnemonic_ru": "她 — женщина 女 + 也 (тоже): «она тоже» — женский вариант «он»."
  },
  {
    "id": "hsk:0005",
    "hanzi": "是",
    "pinyin": "shì",
    "en_meaning": "to be",
    "ru_meaning": "быть; являться",
    "hsk_level": 1,
    "example_zh": "我是中国人。",
    "example_pinyin": "Wǒ shì Zhōngguórén.",
    "example_en": "I am Chinese.",
    "mnemonic_ru": "是 — знак похож на «то самое верное»: 是 значит «быть, являться именно этим»."
  },
  {
    "id": "hsk:0006",
    "hanzi": "的",
    "pinyin": "de",
    "en_meaning": "possessive particle; of",
    "ru_meaning": "частица принадлежности",
    "hsk_level": 1,
    "example_zh": "我的书。",
    "example_pinyin": "Wǒ de shū.",
    "example_en": "My book.",
    "mnemonic_ru": "的 — маленькая частица-«ложка» 勺 рядом с 白: показывает, кому что принадлежит."
  },
  {
    "id": "hsk:0007",
    "hanzi": "一",
    "pinyin": "yī",
    "en_meaning": "one; a; an",
    "ru_meaning": "один; одна",
    "hsk_level": 1,
    "example_zh": "一个学生。",
    "example_pinyin": "Yī ge xuésheng.",
    "example_en": "One student.",
    "mnemonic_ru": "一 — одна горизонтальная черта: проще некуда — это «один»."
  },
  {
    "id": "hsk:0008",
    "hanzi": "二",
    "pinyin": "èr",
    "en_meaning": "two",
    "ru_meaning": "два; две",
    "hsk_level": 1,
    "example_zh": "二个人。",
    "example_pinyin": "Èr ge rén.",
    "example_en": "Two people.",
    "mnemonic_ru": "二 — две горизонтальные черты одна над другой: «два»."
  },
  {
    "id": "hsk:0009",
    "hanzi": "三",
    "pinyin": "sān",
    "en_meaning": "three",
    "ru_meaning": "три",
    "hsk_level": 1,
    "example_zh": "三本书。",
    "example_pinyin": "Sān běn shū.",
    "example_en": "Three books.",
    "mnemonic_ru": "三 — три горизонтальные черты: «три», считаем по линиям."
  },
  {
    "id": "hsk:0010",
    "hanzi": "四",
    "pinyin": "sì",
    "en_meaning": "four",
    "ru_meaning": "четыре",
    "hsk_level": 1,
    "example_zh": "四个苹果。",
    "example_pinyin": "Sì ge píngguǒ.",
    "example_en": "Four apples.",
    "mnemonic_ru": "四 — квадрат-рамка 囗 с ножками внутри: похоже на стол на четырёх ногах."
  },
  {
    "id": "hsk:0011",
    "hanzi": "五",
    "pinyin": "wǔ",
    "en_meaning": "five",
    "ru_meaning": "пять",
    "hsk_level": 1,
    "example_zh": "五个学生。",
    "example_pinyin": "Wǔ ge xuésheng.",
    "example_en": "Five students.",
    "mnemonic_ru": "五 — крестик внутри рамки: представь пятерню растопыренных пальцев."
  },
  {
    "id": "hsk:0012",
    "hanzi": "六",
    "pinyin": "liù",
    "en_meaning": "six",
    "ru_meaning": "шесть",
    "hsk_level": 1,
    "example_zh": "六本书。",
    "example_pinyin": "Liù běn shū.",
    "example_en": "Six books.",
    "mnemonic_ru": "六 — крыша над двумя ножками: похоже на домик с цифрой шесть на крыше."
  },
  {
    "id": "hsk:0013",
    "hanzi": "七",
    "pinyin": "qī",
    "en_meaning": "seven",
    "ru_meaning": "семь",
    "hsk_level": 1,
    "example_zh": "七个人。",
    "example_pinyin": "Qī ge rén.",
    "example_en": "Seven people.",
    "mnemonic_ru": "七 — крест с крючком: похоже на разрезание надвое, семь — простое число."
  },
  {
    "id": "hsk:0014",
    "hanzi": "八",
    "pinyin": "bā",
    "en_meaning": "eight",
    "ru_meaning": "восемь",
    "hsk_level": 1,
    "example_zh": "八个苹果。",
    "example_pinyin": "Bā ge píngguǒ.",
    "example_en": "Eight apples.",
    "mnemonic_ru": "八 — две расходящиеся черты: представь восьмёрку, «разделённую» пополам."
  },
  {
    "id": "hsk:0015",
    "hanzi": "九",
    "pinyin": "jiǔ",
    "en_meaning": "nine",
    "ru_meaning": "девять",
    "hsk_level": 1,
    "example_zh": "九本书。",
    "example_pinyin": "Jiǔ běn shū.",
    "example_en": "Nine books.",
    "mnemonic_ru": "九 — крючок с загибом: похоже на цифру 9 на бумаге."
  },
  {
    "id": "hsk:0016",
    "hanzi": "十",
    "pinyin": "shí",
    "en_meaning": "ten",
    "ru_meaning": "десять",
    "hsk_level": 1,
    "example_zh": "十个学生。",
    "example_pinyin": "Shí ge xuésheng.",
    "example_en": "Ten students.",
    "mnemonic_ru": "十 — вертикальная и горизонтальная черта пересекаются: как крест, ровно десять."
  },
  {
    "id": "hsk:0017",
    "hanzi": "个",
    "pinyin": "ge",
    "en_meaning": "measure word for items",
    "ru_meaning": "классификатор для предметов",
    "hsk_level": 1,
    "example_zh": "三个人。",
    "example_pinyin": "Sān ge rén.",
    "example_en": "Three people.",
    "mnemonic_ru": "个 — человек 人 с чёрточкой сверху: счётное слово почти для любого «предмета»."
  },
  {
    "id": "hsk:0018",
    "hanzi": "人",
    "pinyin": "rén",
    "en_meaning": "person; people",
    "ru_meaning": "человек; люди",
    "hsk_level": 1,
    "example_zh": "他是一个人。",
    "example_pinyin": "Tā shì yī ge rén.",
    "example_en": "He is a person.",
    "mnemonic_ru": "人 — две ноги идущего человечка: простой рисунок человека."
  },
  {
    "id": "hsk:0019",
    "hanzi": "学生",
    "pinyin": "xuésheng",
    "en_meaning": "student",
    "ru_meaning": "студент; ученик",
    "hsk_level": 1,
    "example_zh": "我是学生。",
    "example_pinyin": "Wǒ shì xuésheng.",
    "example_en": "I am a student.",
    "mnemonic_ru": "学生 = 学 учиться + 生 рождаться/жизнь: «тот, кто рождается заново через учёбу» — студент."
  },
  {
    "id": "hsk:0020",
    "hanzi": "老师",
    "pinyin": "lǎoshī",
    "en_meaning": "teacher",
    "ru_meaning": "учитель; преподаватель",
    "hsk_level": 1,
    "example_zh": "他是老师。",
    "example_pinyin": "Tā shì lǎoshī.",
    "example_en": "He is a teacher.",
    "mnemonic_ru": "老师 = 老 старый + 师 наставник: «старший наставник» — учитель."
  },
  {
    "id": "hsk:0021",
    "hanzi": "医生",
    "pinyin": "yīshēng",
    "en_meaning": "doctor",
    "ru_meaning": "врач",
    "hsk_level": 1,
    "example_zh": "她是医生。",
    "example_pinyin": "Tā shì yīshēng.",
    "example_en": "She is a doctor.",
    "mnemonic_ru": "医生 = 医 врачевание + 生 жизнь: «тот, кто спасает жизнь» — врач."
  },
  {
    "id": "hsk:0022",
    "hanzi": "妈妈",
    "pinyin": "māma",
    "en_meaning": "mother; mom",
    "ru_meaning": "мама; мать",
    "hsk_level": 1,
    "example_zh": "这是我的妈妈。",
    "example_pinyin": "Zhè shì wǒ de māma.",
    "example_en": "This is my mother.",
    "mnemonic_ru": "妈妈 — женщина 女 + звук 马 (mǎ): удвоенное ласковое «мама»."
  },
  {
    "id": "hsk:0023",
    "hanzi": "爸爸",
    "pinyin": "bàba",
    "en_meaning": "father; dad",
    "ru_meaning": "папа; отец",
    "hsk_level": 1,
    "example_zh": "这是我的爸爸。",
    "example_pinyin": "Zhè shì wǒ de bàba.",
    "example_en": "This is my father.",
    "mnemonic_ru": "爸爸 — сверху 父 (отец, рука с топором — кормилец), удвоено: «папа»."
  },
  {
    "id": "hsk:0024",
    "hanzi": "朋友",
    "pinyin": "péngyou",
    "en_meaning": "friend",
    "ru_meaning": "друг",
    "hsk_level": 1,
    "example_zh": "他是我的朋友。",
    "example_pinyin": "Tā shì wǒ de péngyou.",
    "example_en": "He is my friend.",
    "mnemonic_ru": "朋友 — две одинаковые половинки 月月 (как двое рядом) + 友 (дружба): друзья похожи друг на друга."
  },
  {
    "id": "hsk:0025",
    "hanzi": "学",
    "pinyin": "xué",
    "en_meaning": "to study; to learn",
    "ru_meaning": "учиться; изучать",
    "hsk_level": 1,
    "example_zh": "我学中文。",
    "example_pinyin": "Wǒ xué Zhōngwén.",
    "example_en": "I study Chinese.",
    "mnemonic_ru": "学 — сверху «руки строят крышу знаний» над ребёнком 子: «учиться» под кровом школы."
  },
  {
    "id": "hsk:0026",
    "hanzi": "看",
    "pinyin": "kàn",
    "en_meaning": "to look; to watch; to see",
    "ru_meaning": "смотреть; видеть",
    "hsk_level": 1,
    "example_zh": "我看书。",
    "example_pinyin": "Wǒ kàn shū.",
    "example_en": "I read a book.",
    "mnemonic_ru": "看 — рука 手 над глазом 目 (прикрыть глаза от солнца): «смотреть вдаль»."
  },
  {
    "id": "hsk:0027",
    "hanzi": "听",
    "pinyin": "tīng",
    "en_meaning": "to listen; to hear",
    "ru_meaning": "слушать; слышать",
    "hsk_level": 1,
    "example_zh": "我听老师。",
    "example_pinyin": "Wǒ tīng lǎoshī.",
    "example_en": "I listen to the teacher.",
    "mnemonic_ru": "听 — рот 口 и ухо рядом: слушаешь ртом переспрашивая, ухом воспринимая."
  },
  {
    "id": "hsk:0028",
    "hanzi": "说",
    "pinyin": "shuō",
    "en_meaning": "to speak; to say; to tell",
    "ru_meaning": "говорить; сказать",
    "hsk_level": 1,
    "example_zh": "他说中文。",
    "example_pinyin": "Tā shuō Zhōngwén.",
    "example_en": "He speaks Chinese.",
    "mnemonic_ru": "说 — слово 讠 + 兑 (обменивать): обмен словами — «говорить»."
  },
  {
    "id": "hsk:0029",
    "hanzi": "写",
    "pinyin": "xiě",
    "en_meaning": "to write",
    "ru_meaning": "писать",
    "hsk_level": 1,
    "example_zh": "我写字。",
    "example_pinyin": "Wǒ xiě zì.",
    "example_en": "I write characters.",